{
  "contractVersion": 1,
  "observations": [
    {
      "id": "44444444-4444-4444-8444-444444444444",
      "kind": "frozenTemplate",
      "maximumBytes": 268435456,
      "required": true
    }
  ],
  "preparationRevision": 1,
  "requestID": "11111111-1111-4111-8111-111111111111",
  "snapshotHash": "0000000000000000000000000000000000000000000000000000000000000000"
}
